"DESCRIPTION","DURATION IN MS","NAME","PARENT SUITE","START TIME","STATUS","STOP TIME","SUB SUITE","SUITE","TEST CLASS","TEST METHOD"
"","282","Check 200 Page (example #2)","","Mon Jun 02 12:24:10 UTC 2025","passed","Mon Jun 02 12:24:10 UTC 2025","","I want check respose code at a Links Page","I want check respose code at a Links Page","Check 200 Page (example #2)"
"","101","Check 200 Page (example #3)","","Mon Jun 02 12:24:10 UTC 2025","passed","Mon Jun 02 12:24:10 UTC 2025","","I want check respose code at a Links Page","I want check respose code at a Links Page","Check 200 Page (example #3)"
"","2117","I go to the Home Page Website","","Mon Jun 02 12:24:04 UTC 2025","broken","Mon Jun 02 12:24:06 UTC 2025","","I want check some Eleevenys at a Home Page","I want check some Eleevenys at a Home Page","I go to the Home Page Website"
"","260","Check 200 Page (example #1)","","Mon Jun 02 12:24:09 UTC 2025","passed","Mon Jun 02 12:24:10 UTC 2025","","I want check respose code at a Links Page","I want check respose code at a Links Page","Check 200 Page (example #1)"
"","2519","Login as new sign up user with valid data","","Mon Jun 02 12:24:13 UTC 2025","passed","Mon Jun 02 12:24:15 UTC 2025","","I want to login into the site with valid data","I want to login into the site with valid data","Login as new sign up user with valid data"
