"DESCRIPTION","DURATION IN MS","NAME","PARENT SUITE","START TIME","STATUS","STOP TIME","SUB SUITE","SUITE","TEST CLASS","TEST METHOD"
"","61","Check 200 Page (example #3)","","Wed Aug 20 12:23:53 UTC 2025","passed","Wed Aug 20 12:23:53 UTC 2025","","I want check respose code at a Links Page","I want check respose code at a Links Page","Check 200 Page (example #3)"
"","237","Check 200 Page (example #1)","","Wed Aug 20 12:23:53 UTC 2025","passed","Wed Aug 20 12:23:53 UTC 2025","","I want check respose code at a Links Page","I want check respose code at a Links Page","Check 200 Page (example #1)"
"","2520","Login as new sign up user with valid data","","Wed Aug 20 12:23:56 UTC 2025","passed","Wed Aug 20 12:23:58 UTC 2025","","I want to login into the site with valid data","I want to login into the site with valid data","Login as new sign up user with valid data"
"","2115","I go to the Home Page Website","","Wed Aug 20 12:23:47 UTC 2025","broken","Wed Aug 20 12:23:50 UTC 2025","","I want check some Eleevenys at a Home Page","I want check some Eleevenys at a Home Page","I go to the Home Page Website"
"","75","Check 200 Page (example #2)","","Wed Aug 20 12:23:53 UTC 2025","passed","Wed Aug 20 12:23:53 UTC 2025","","I want check respose code at a Links Page","I want check respose code at a Links Page","Check 200 Page (example #2)"
