"DESCRIPTION","DURATION IN MS","NAME","PARENT SUITE","START TIME","STATUS","STOP TIME","SUB SUITE","SUITE","TEST CLASS","TEST METHOD"
"","219","Check 200 Page (example #1)","","Mon Jun 09 12:23:52 UTC 2025","passed","Mon Jun 09 12:23:52 UTC 2025","","I want check respose code at a Links Page","I want check respose code at a Links Page","Check 200 Page (example #1)"
"","296","Check 200 Page (example #2)","","Mon Jun 09 12:23:52 UTC 2025","passed","Mon Jun 09 12:23:53 UTC 2025","","I want check respose code at a Links Page","I want check respose code at a Links Page","Check 200 Page (example #2)"
"","89","Check 200 Page (example #3)","","Mon Jun 09 12:23:53 UTC 2025","passed","Mon Jun 09 12:23:53 UTC 2025","","I want check respose code at a Links Page","I want check respose code at a Links Page","Check 200 Page (example #3)"
"","3792","Login as new sign up user with valid data","","Mon Jun 09 12:23:55 UTC 2025","passed","Mon Jun 09 12:23:59 UTC 2025","","I want to login into the site with valid data","I want to login into the site with valid data","Login as new sign up user with valid data"
"","2789","I go to the Home Page Website","","Mon Jun 09 12:23:46 UTC 2025","broken","Mon Jun 09 12:23:49 UTC 2025","","I want check some Eleevenys at a Home Page","I want check some Eleevenys at a Home Page","I go to the Home Page Website"
