"DESCRIPTION","DURATION IN MS","NAME","PARENT SUITE","START TIME","STATUS","STOP TIME","SUB SUITE","SUITE","TEST CLASS","TEST METHOD"
"","312","Check 200 Page (example #1)","","Tue Jun 17 12:25:05 UTC 2025","passed","Tue Jun 17 12:25:05 UTC 2025","","I want check respose code at a Links Page","I want check respose code at a Links Page","Check 200 Page (example #1)"
"","86","Check 200 Page (example #2)","","Tue Jun 17 12:25:05 UTC 2025","passed","Tue Jun 17 12:25:05 UTC 2025","","I want check respose code at a Links Page","I want check respose code at a Links Page","Check 200 Page (example #2)"
"","2128","I go to the Home Page Website","","Tue Jun 17 12:24:59 UTC 2025","broken","Tue Jun 17 12:25:01 UTC 2025","","I want check some Eleevenys at a Home Page","I want check some Eleevenys at a Home Page","I go to the Home Page Website"
"","2595","Login as new sign up user with valid data","","Tue Jun 17 12:25:08 UTC 2025","passed","Tue Jun 17 12:25:10 UTC 2025","","I want to login into the site with valid data","I want to login into the site with valid data","Login as new sign up user with valid data"
"","73","Check 200 Page (example #3)","","Tue Jun 17 12:25:05 UTC 2025","passed","Tue Jun 17 12:25:05 UTC 2025","","I want check respose code at a Links Page","I want check respose code at a Links Page","Check 200 Page (example #3)"
