"DESCRIPTION","DURATION IN MS","NAME","PARENT SUITE","START TIME","STATUS","STOP TIME","SUB SUITE","SUITE","TEST CLASS","TEST METHOD"
"","2936","Login as new sign up user with valid data","","Tue Sep 02 12:24:07 UTC 2025","passed","Tue Sep 02 12:24:10 UTC 2025","","I want to login into the site with valid data","I want to login into the site with valid data","Login as new sign up user with valid data"
"","2087","I go to the Home Page Website","","Tue Sep 02 12:23:59 UTC 2025","broken","Tue Sep 02 12:24:01 UTC 2025","","I want check some Eleevenys at a Home Page","I want check some Eleevenys at a Home Page","I go to the Home Page Website"
"","317","Check 200 Page (example #1)","","Tue Sep 02 12:24:04 UTC 2025","passed","Tue Sep 02 12:24:05 UTC 2025","","I want check respose code at a Links Page","I want check respose code at a Links Page","Check 200 Page (example #1)"
"","75","Check 200 Page (example #2)","","Tue Sep 02 12:24:05 UTC 2025","passed","Tue Sep 02 12:24:05 UTC 2025","","I want check respose code at a Links Page","I want check respose code at a Links Page","Check 200 Page (example #2)"
"","71","Check 200 Page (example #3)","","Tue Sep 02 12:24:05 UTC 2025","passed","Tue Sep 02 12:24:05 UTC 2025","","I want check respose code at a Links Page","I want check respose code at a Links Page","Check 200 Page (example #3)"
