"DESCRIPTION","DURATION IN MS","NAME","PARENT SUITE","START TIME","STATUS","STOP TIME","SUB SUITE","SUITE","TEST CLASS","TEST METHOD"
"","85","Check 200 Page (example #3)","","Wed Jun 04 12:24:19 UTC 2025","passed","Wed Jun 04 12:24:19 UTC 2025","","I want check respose code at a Links Page","I want check respose code at a Links Page","Check 200 Page (example #3)"
"","218","Check 200 Page (example #2)","","Wed Jun 04 12:24:19 UTC 2025","passed","Wed Jun 04 12:24:19 UTC 2025","","I want check respose code at a Links Page","I want check respose code at a Links Page","Check 200 Page (example #2)"
"","2567","I go to the Home Page Website","","Wed Jun 04 12:24:07 UTC 2025","broken","Wed Jun 04 12:24:09 UTC 2025","","I want check some Eleevenys at a Home Page","I want check some Eleevenys at a Home Page","I go to the Home Page Website"
"","3422","Login as new sign up user with valid data","","Wed Jun 04 12:24:12 UTC 2025","passed","Wed Jun 04 12:24:15 UTC 2025","","I want to login into the site with valid data","I want to login into the site with valid data","Login as new sign up user with valid data"
"","291","Check 200 Page (example #1)","","Wed Jun 04 12:24:18 UTC 2025","passed","Wed Jun 04 12:24:19 UTC 2025","","I want check respose code at a Links Page","I want check respose code at a Links Page","Check 200 Page (example #1)"
